{"analyses":[{"analysis_id":"analysis-base","applicability":{"changed_dependencies":["source.synthetic"],"rationale":"The source, mapping or context basis changed and requires an explicit new declaration.","status":"needs_reassessment"},"change":{"changed_dependencies":["source.synthetic"],"summary":"Explicit successor under the supplied revision declaration."},"dependencies":[{"dependency_id":"source.synthetic","depends_on":[],"description":"Exact supplied fixture content for source.synthetic.","kind":"synthetic_supplied_value","rationale":"The source explicitly marks the fixture content as synthetic supplied mathematics.","reference_ids":["ref.synthetic-status"],"role":"source_support"},{"dependency_id":"source.states","depends_on":[],"description":"Exact supplied fixture content for source.states.","kind":"synthetic_supplied_value","rationale":"The source explicitly marks the fixture content as synthetic supplied mathematics.","reference_ids":["ref.states"],"role":"source_support"},{"dependency_id":"source.marginals","depends_on":[],"description":"Exact supplied fixture content for source.marginals.","kind":"synthetic_supplied_value","rationale":"The source explicitly marks the fixture content as synthetic supplied mathematics.","reference_ids":["ref.marginals"],"role":"source_support"},{"dependency_id":"source.parameterization","depends_on":[],"description":"Exact supplied fixture content for source.parameterization.","kind":"synthetic_supplied_value","rationale":"The source explicitly marks the fixture content as synthetic supplied mathematics.","reference_ids":["ref.parameterization"],"role":"source_support"},{"dependency_id":"source.unit","depends_on":[],"description":"Exact supplied fixture content for source.unit.","kind":"synthetic_supplied_value","rationale":"The source explicitly marks the fixture content as synthetic supplied mathematics.","reference_ids":["ref.unit"],"role":"source_support"},{"dependency_id":"source.loss-a","depends_on":[],"description":"Exact supplied fixture content for source.loss-a.","kind":"synthetic_supplied_value","rationale":"The source explicitly marks the fixture content as synthetic supplied mathematics.","reference_ids":["ref.loss-a"],"role":"source_support"},{"dependency_id":"source.loss-b","depends_on":[],"description":"Exact supplied fixture content for source.loss-b.","kind":"synthetic_supplied_value","rationale":"The source explicitly marks the fixture content as synthetic supplied mathematics.","reference_ids":["ref.loss-b"],"role":"source_support"},{"dependency_id":"source.loss-c","depends_on":[],"description":"Exact supplied fixture content for source.loss-c.","kind":"synthetic_supplied_value","rationale":"The source explicitly marks the fixture content as synthetic supplied mathematics.","reference_ids":["ref.loss-c"],"role":"source_support"},{"dependency_id":"choice.exact-family","depends_on":["source.synthetic"],"description":"Treat the declared finite linear constraints as the complete model family.","kind":"modelling_choice","rationale":"The fixture declares no omitted mathematical constraint.","reference_ids":[],"role":"model_construction"},{"dependency_id":"choice.unrestricted","depends_on":[],"description":"The separately authored unrestricted dependence premise.","kind":"modelling_choice","rationale":"The dependence premise is explicit and is not inferred from shared source identity.","reference_ids":[],"role":"model_construction"},{"dependency_id":"transform.joint-family","depends_on":["source.states","source.marginals","source.parameterization","choice.unrestricted"],"description":"Expand the supplied marginals and explicit dependence premise into exact rows.","kind":"deterministic_transformation","rationale":"Every coefficient and rational right-hand side is supplied or derived exactly.","reference_ids":[],"role":"model_construction"},{"dependency_id":"transform.loss-rows","depends_on":["source.states","source.loss-a","source.loss-b","source.loss-c"],"description":"Preserve the three supplied action loss rows in declared world order.","kind":"deterministic_transformation","rationale":"No optimization result is authored by this transformation.","reference_ids":[],"role":"model_construction"},{"dependency_id":"subject.problem","depends_on":["choice.exact-family","transform.joint-family"],"description":"The exact byte-bound finite linear family supplied to the checker.","kind":"mathematical_subject","rationale":"It preserves the family, state order, rows and exact rational strings.","reference_ids":[],"role":"model_construction"},{"dependency_id":"subject.query","depends_on":["subject.problem","transform.loss-rows","source.unit"],"description":"The exact byte-bound requested operation.","kind":"mathematical_subject","rationale":"The operation, loss unit and any action rows remain explicit.","reference_ids":[],"role":"model_construction"},{"dependency_id":"use.checked","depends_on":["subject.problem","subject.query"],"description":"A recipient may use only a fresh exact check for this subject.","kind":"checked_use","rationale":"A stored solver status or success flag is not authoritative.","reference_ids":[],"role":"checked_mathematical_use"}],"human_review":{"disposition":"unreviewed","reviewer":null},"intended_use":"static_expected_loss_decision","kind":"revision","mathematical_subject":{"problem":{"content":"eyJlcXVhbGl0aWVzIjpbeyJjb2VmZmljaWVudHMiOlsiMCIsIjAiLCIxIiwiMSJdLCJsYWJlbCI6InhfbWFyZ2luYWwiLCJyaHMiOiIxLzQifSx7ImNvZWZmaWNpZW50cyI6WyIwIiwiMSIsIjAiLCIxIl0sImxhYmVsIjoieV9tYXJnaW5hbCIsInJocyI6IjEvNCJ9XSwiZmFtaWx5X2tpbmQiOiJleGFjdF9mYW1pbHkiLCJmYW1pbHlfbGFiZWwiOiJiZXRhX3Vuc3BlY2lmaWVkX2RlcGVuZGVuY2VfcV8wXzFfNCIsImluZXF1YWxpdGllcyI6W3siY29lZmZpY2llbnRzIjpbIjAiLCIwIiwiMCIsIi0xIl0sImxhYmVsIjoicV9sb3dlciIsInJocyI6IjAifSx7ImNvZWZmaWNpZW50cyI6WyIwIiwiMCIsIjAiLCIxIl0sImxhYmVsIjoicV91cHBlciIsInJocyI6IjEvNCJ9XSwibm9ybWFsaXphdGlvbiI6ImV4YWN0X29uZSIsInNlbWFudGljcyI6ImZpbml0ZS1saW5lYXItdW5jZXJ0YWludHkudjEiLCJzdGF0ZXMiOlsiWD0wLFk9MCIsIlg9MCxZPTEiLCJYPTEsWT0wIiwiWD0xLFk9MSJdfQo=","encoding":"base64","sha256":"sha256:3594d4735405ad535805cd6f3e9b8c6f417cf43725c1db97028269f0756e35eb"},"query":{"content":"eyJhY3Rpb25zIjpbeyJsYWJlbCI6IkEiLCJsb3NzZXMiOlsiMSIsIjEiLCIxIiwiMTciXX0seyJsYWJlbCI6IkIiLCJsb3NzZXMiOlsiNS8yIiwiNS8yIiwiNS8yIiwiNS8yIl19LHsibGFiZWwiOiJDIiwibG9zc2VzIjpbIjEiLCI1IiwiNSIsIjUiXX1dLCJsYWJlbCI6ImNob29zZV9hX2Jfb3JfYyIsIm9wZXJhdGlvbiI6ImRlY2lzaW9uIiwic2VtYW50aWNzIjoiZmluaXRlLWxpbmVhci11bmNlcnRhaW50eS52MSJ9Cg==","encoding":"base64","sha256":"sha256:7fc535d88fafed871ff3d234781774745d5eeab6b529145a385025cb5f951fa0"}},"model_mappings":[{"dependency_ids":["choice.exact-family"],"target":"problem.family_kind"},{"dependency_ids":["source.states"],"target":"problem.states"},{"dependency_ids":["transform.joint-family"],"target":"problem.equalities:x_marginal"},{"dependency_ids":["transform.joint-family"],"target":"problem.equalities:y_marginal"},{"dependency_ids":["transform.joint-family"],"target":"problem.inequalities:q_lower"},{"dependency_ids":["transform.joint-family"],"target":"problem.inequalities:q_upper"},{"dependency_ids":["subject.query"],"target":"query.operation"},{"dependency_ids":["source.unit"],"target":"query.unit"},{"dependency_ids":["transform.loss-rows"],"target":"query.action:A"},{"dependency_ids":["transform.loss-rows"],"target":"query.action:B"},{"dependency_ids":["transform.loss-rows"],"target":"query.action:C"}],"previous_analysis_id":null,"prohibited_uses":["empirical_estimate","causal_effect","sequential_policy","safety_certificate","authority_to_act"],"question":"Which supplied action minimizes expected fictional loss in every joint model permitted by this analyst's declared assumptions?","unit":"fictional_loss_unit"},{"analysis_id":"control-q-b","applicability":{"changed_dependencies":["source.synthetic"],"rationale":"The source, mapping or context basis changed and requires an explicit new declaration.","status":"needs_reassessment"},"change":{"changed_dependencies":["source.synthetic"],"summary":"Explicit successor under the supplied revision declaration."},"dependencies":[{"dependency_id":"source.synthetic","depends_on":[],"description":"Exact supplied fixture content for source.synthetic.","kind":"synthetic_supplied_value","rationale":"The source explicitly marks the fixture content as synthetic supplied mathematics.","reference_ids":["ref.synthetic-status"],"role":"source_support"},{"dependency_id":"source.states","depends_on":[],"description":"Exact supplied fixture content for source.states.","kind":"synthetic_supplied_value","rationale":"The source explicitly marks the fixture content as synthetic supplied mathematics.","reference_ids":["ref.states"],"role":"source_support"},{"dependency_id":"source.marginals","depends_on":[],"description":"Exact supplied fixture content for source.marginals.","kind":"synthetic_supplied_value","rationale":"The source explicitly marks the fixture content as synthetic supplied mathematics.","reference_ids":["ref.marginals"],"role":"source_support"},{"dependency_id":"source.parameterization","depends_on":[],"description":"Exact supplied fixture content for source.parameterization.","kind":"synthetic_supplied_value","rationale":"The source explicitly marks the fixture content as synthetic supplied mathematics.","reference_ids":["ref.parameterization"],"role":"source_support"},{"dependency_id":"source.unit","depends_on":[],"description":"Exact supplied fixture content for source.unit.","kind":"synthetic_supplied_value","rationale":"The source explicitly marks the fixture content as synthetic supplied mathematics.","reference_ids":["ref.unit"],"role":"source_support"},{"dependency_id":"source.loss-a","depends_on":[],"description":"Exact supplied fixture content for source.loss-a.","kind":"synthetic_supplied_value","rationale":"The source explicitly marks the fixture content as synthetic supplied mathematics.","reference_ids":["ref.loss-a"],"role":"source_support"},{"dependency_id":"source.loss-b","d